[
 {
  "record_id": "FS-004759",
  "disposition": "ADVANCE",
  "primary_code": "",
  "secondary_codes": [],
  "study_type_hint": "acute_bout_CoreA",
  "note": "Marathon; pre/post/48h CRP with baseline"
 },
 {
  "record_id": "FS-004760",
  "disposition": "ADVANCE",
  "primary_code": "",
  "secondary_codes": [],
  "study_type_hint": "acute_bout_CoreA",
  "note": "Leukocyte/PMN elastase, chemiluminescence immediately post-run"
 },
 {
  "record_id": "FS-004761",
  "disposition": "ADVANCE",
  "primary_code": "",
  "secondary_codes": [],
  "study_type_hint": "acute_bout_CoreA",
  "note": "CD34+ progenitor mobilization after HIIT, pre/post"
 },
 {
  "record_id": "FS-004762",
  "disposition": "EXCLUDE_TA",
  "primary_code": "FT04",
  "secondary_codes": [],
  "study_type_hint": "other",
  "note": "Bed rest with countermeasures; no acute bout sampling"
 },
 {
  "record_id": "FS-004763",
  "disposition": "ADVANCE",
  "primary_code": "",
  "secondary_codes": [],
  "study_type_hint": "acute_bout_CoreA",
  "note": "Post-exercise IL-6/hepcidin; sleep-deprivation contrast"
 },
 {
  "record_id": "FS-004764",
  "disposition": "ADVANCE",
  "primary_code": "",
  "secondary_codes": [],
  "study_type_hint": "acute_bout_CoreA",
  "note": "Muscle methylation incl IL-6/TNF-alpha genes post-bout; borderline"
 },
 {
  "record_id": "FS-004765",
  "disposition": "ADVANCE",
  "primary_code": "",
  "secondary_codes": [],
  "study_type_hint": "acute_bout_CoreA",
  "note": "Marathon; pre/0/48h CRP measured"
 },
 {
  "record_id": "FS-004766",
  "disposition": "ADVANCE",
  "primary_code": "",
  "secondary_codes": [],
  "study_type_hint": "acute_bout_CoreA",
  "note": "Milk vs water trials; stimulated neutrophil elastase"
 },
 {
  "record_id": "FS-004768",
  "disposition": "EXCLUDE_TA",
  "primary_code": "FT04",
  "secondary_codes": [],
  "study_type_hint": "chronic_training_only",
  "note": "24-week training RCT; resting outcomes, no bout"
 },
 {
  "record_id": "FS-004769",
  "disposition": "ADVANCE",
  "primary_code": "",
  "secondary_codes": [],
  "study_type_hint": "acute_bout_CoreA",
  "note": "Multi-omics incl immunome after bout; health status at full text"
 },
 {
  "record_id": "FS-004770",
  "disposition": "ADVANCE",
  "primary_code": "",
  "secondary_codes": [],
  "study_type_hint": "acute_bout_CoreA",
  "note": "Placebo-controlled; urine IL-6 after half-marathon"
 },
 {
  "record_id": "FS-004771",
  "disposition": "ADVANCE",
  "primary_code": "",
  "secondary_codes": [],
  "study_type_hint": "acute_bout_CoreA",
  "note": "Cyclists pre/post race; leukocyte correlations"
 },
 {
  "record_id": "FS-004772",
  "disposition": "ADVANCE",
  "primary_code": "",
  "secondary_codes": [],
  "study_type_hint": "acute_bout_CoreA",
  "note": "Eccentric bout; TNF-alpha among measured markers"
 },
 {
  "record_id": "FS-004773",
  "disposition": "ADVANCE",
  "primary_code": "",
  "secondary_codes": [],
  "study_type_hint": "acute_bout_CoreA",
  "note": "Case study; leukocyte shifts after record dive"
 },
 {
  "record_id": "FS-004775",
  "disposition": "EXCLUDE_TA",
  "primary_code": "FT01",
  "secondary_codes": [],
  "study_type_hint": "other",
  "note": "StatPearls overview chapter; no original data"
 },
 {
  "record_id": "FS-004776",
  "disposition": "ADVANCE",
  "primary_code": "",
  "secondary_codes": [],
  "study_type_hint": "acute_bout_CoreA",
  "note": "Placebo-controlled; urinary IL-6/IL-8 after race"
 },
 {
  "record_id": "FS-004777",
  "disposition": "ADVANCE",
  "primary_code": "",
  "secondary_codes": [],
  "study_type_hint": "acute_bout_CoreA",
  "note": "Cytokines pre/post interval session"
 },
 {
  "record_id": "FS-004778",
  "disposition": "EXCLUDE_TA",
  "primary_code": "FT03",
  "secondary_codes": [
   "FT04"
  ],
  "study_type_hint": "other",
  "note": "Anaphylaxis patients; IgE immunoblots only, no bout"
 },
 {
  "record_id": "FS-004779",
  "disposition": "ADVANCE",
  "primary_code": "",
  "secondary_codes": [],
  "study_type_hint": "acute_bout_CoreA",
  "note": "Hot yoga bout; cytokines pre/30-min post"
 },
 {
  "record_id": "FS-004780",
  "disposition": "EXCLUDE_TA",
  "primary_code": "FT03",
  "secondary_codes": [],
  "study_type_hint": "other",
  "note": "COPD patients; clinical cohort"
 },
 {
  "record_id": "FS-004781",
  "disposition": "ADVANCE",
  "primary_code": "",
  "secondary_codes": [],
  "study_type_hint": "acute_bout_CoreA",
  "note": "T1D and healthy adults separate groups; stratum separable"
 },
 {
  "record_id": "FS-004782",
  "disposition": "ADVANCE",
  "primary_code": "",
  "secondary_codes": [],
  "study_type_hint": "acute_bout_CoreA",
  "note": "Marathon; CRP/IL-6/IL-10/TNF-alpha time course"
 },
 {
  "record_id": "FS-004783",
  "disposition": "ADVANCE",
  "primary_code": "",
  "secondary_codes": [],
  "study_type_hint": "acute_bout_CoreA",
  "note": "Resistance bout; IL-6 measured pre/10-min post"
 },
 {
  "record_id": "FS-004784",
  "disposition": "ADVANCE",
  "primary_code": "",
  "secondary_codes": [],
  "study_type_hint": "acute_bout_CoreA",
  "note": "Girls vs women separate; adult stratum separable"
 },
 {
  "record_id": "FS-004785",
  "disposition": "ADVANCE",
  "primary_code": "",
  "secondary_codes": [],
  "study_type_hint": "acute_bout_CoreA",
  "note": "Half-marathon; hemochrome leukocytes, microparticle assays"
 },
 {
  "record_id": "FS-004786",
  "disposition": "ADVANCE",
  "primary_code": "",
  "secondary_codes": [],
  "study_type_hint": "acute_bout_CoreA",
  "note": "Placebo-controlled EPO trial; selectins/PF4 (CXCL4)"
 },
 {
  "record_id": "FS-004787",
  "disposition": "ADVANCE",
  "primary_code": "",
  "secondary_codes": [],
  "study_type_hint": "acute_bout_CoreA",
  "note": "Ultra-trail; hs-CRP, garment vs control group"
 },
 {
  "record_id": "FS-004788",
  "disposition": "ADVANCE",
  "primary_code": "",
  "secondary_codes": [],
  "study_type_hint": "acute_bout_CoreA",
  "note": "Ultra-trail; hs-CRP and myeloperoxidase pre/post"
 },
 {
  "record_id": "FS-004789",
  "disposition": "EXCLUDE_TA",
  "primary_code": "FT04",
  "secondary_codes": [
   "FT07"
  ],
  "study_type_hint": "other",
  "note": "Hyperhydration/ABP study; no bout, Hb/reticulocytes only"
 },
 {
  "record_id": "FS-004790",
  "disposition": "ADVANCE",
  "primary_code": "",
  "secondary_codes": [],
  "study_type_hint": "acute_bout_CoreA",
  "note": "Exhaustive run; lymphocyte DNA damage pre/post"
 },
 {
  "record_id": "FS-004791",
  "disposition": "ADVANCE",
  "primary_code": "",
  "secondary_codes": [],
  "study_type_hint": "acute_bout_CoreA",
  "note": "Calprotectin/suPAR/CD163/cytokines pre/3h post exertion"
 },
 {
  "record_id": "FS-004792",
  "disposition": "EXCLUDE_TA",
  "primary_code": "FT04",
  "secondary_codes": [],
  "study_type_hint": "cross_sectional_resting",
  "note": "Cross-sectional smokers; resting markers, test for capacity only"
 },
 {
  "record_id": "FS-004793",
  "disposition": "ADVANCE",
  "primary_code": "",
  "secondary_codes": [],
  "study_type_hint": "acute_bout_CoreA",
  "note": "100-km race; resistin/chemerin/hs-CRP pre/post"
 },
 {
  "record_id": "FS-004794",
  "disposition": "ADVANCE",
  "primary_code": "",
  "secondary_codes": [],
  "study_type_hint": "acute_bout_CoreA",
  "note": "Multi-day walking event; inflammation markers, placebo-controlled"
 },
 {
  "record_id": "FS-004795",
  "disposition": "EXCLUDE_TA",
  "primary_code": "FT04",
  "secondary_codes": [],
  "study_type_hint": "chronic_training_only",
  "note": "8-week training; resting adipokines, no bout"
 },
 {
  "record_id": "FS-004796",
  "disposition": "ADVANCE",
  "primary_code": "",
  "secondary_codes": [],
  "study_type_hint": "acute_bout_CoreA",
  "note": "PBMC respiration after low-intensity bout; immune-cell measure"
 },
 {
  "record_id": "FS-004797",
  "disposition": "ADVANCE",
  "primary_code": "",
  "secondary_codes": [],
  "study_type_hint": "acute_bout_CoreA",
  "note": "CRP; occlusion vs placebo after shuttle test"
 },
 {
  "record_id": "FS-004798",
  "disposition": "ADVANCE",
  "primary_code": "",
  "secondary_codes": [],
  "study_type_hint": "acute_bout_CoreA",
  "note": "Shuttle test; CRP pre/post/72h"
 },
 {
  "record_id": "FS-004799",
  "disposition": "EXCLUDE_TA",
  "primary_code": "FT04",
  "secondary_codes": [],
  "study_type_hint": "cross_sectional_resting",
  "note": "BLSA cross-section; MRS recovery metric, no bout sampling"
 },
 {
  "record_id": "FS-004800",
  "disposition": "ADVANCE",
  "primary_code": "",
  "secondary_codes": [],
  "study_type_hint": "acute_bout_CoreA",
  "note": "Race pre/post uNGAL (antimicrobial protein); observational NSAID groups"
 }
]