[
 {
  "record_id": "FS-011070",
  "disposition": "ADVANCE",
  "primary_code": "",
  "secondary_codes": [],
  "study_type_hint": "acute_bout_CoreA",
  "note": "S-PtdSer vs placebo crossover; downhill run; IL-6 to 48 h"
 },
 {
  "record_id": "FS-011081",
  "disposition": "ADVANCE",
  "primary_code": "",
  "secondary_codes": [],
  "study_type_hint": "other",
  "note": "Diet x treadmill test; WBC count/fat oxidation; marginal immune link"
 },
 {
  "record_id": "FS-011101",
  "disposition": "EXCLUDE_TA",
  "primary_code": "FT03",
  "secondary_codes": [],
  "study_type_hint": "acute_bout_CoreA",
  "note": "Induced sputum airway cells after 1000 m; rowers 16.2\u00b11.0 y"
 },
 {
  "record_id": "FS-011106",
  "disposition": "EXCLUDE_TA",
  "primary_code": "FT03",
  "secondary_codes": [],
  "study_type_hint": "acute_bout_CoreA",
  "note": "Chronic fatigue syndrome patients; cytokines/lymphocytes; clinical cohort"
 },
 {
  "record_id": "FS-011130",
  "disposition": "ADVANCE",
  "primary_code": "",
  "secondary_codes": [],
  "study_type_hint": "acute_bout_CoreA",
  "note": "Two exhaustive races; IL-1beta/IL-6/TNF-alpha; trained vs untrained"
 },
 {
  "record_id": "FS-011153",
  "disposition": "ADVANCE",
  "primary_code": "",
  "secondary_codes": [],
  "study_type_hint": "other",
  "note": "Allopurinol; NF-kB in runners' lymphocytes; rat arm; design unclear"
 },
 {
  "record_id": "FS-011154",
  "disposition": "ADVANCE",
  "primary_code": "",
  "secondary_codes": [],
  "study_type_hint": "acute_bout_CoreA",
  "note": "PDGF/TGF-beta/VEGF pre/post bout; sportsmen, age unstated"
 },
 {
  "record_id": "FS-011163",
  "disposition": "EXCLUDE_TA",
  "primary_code": "FT04",
  "secondary_codes": [],
  "study_type_hint": "chronic_training_only",
  "note": "Training intensity/frequency RCT; homocysteine/insulin pre-post, no bout"
 },
 {
  "record_id": "FS-011168",
  "disposition": "ADVANCE",
  "primary_code": "",
  "secondary_codes": [],
  "study_type_hint": "acute_bout_CoreA",
  "note": "Induced-sputum neutrophils/lymphocytes after endurance run; design sparse"
 },
 {
  "record_id": "FS-011174",
  "disposition": "ADVANCE",
  "primary_code": "",
  "secondary_codes": [],
  "study_type_hint": "acute_bout_CoreA",
  "note": "Aerobic vs Wingate bouts; IgA/IgG/IgM/C3/C4 to day 5; controls"
 },
 {
  "record_id": "FS-011179",
  "disposition": "ADVANCE",
  "primary_code": "",
  "secondary_codes": [],
  "study_type_hint": "acute_bout_CoreA",
  "note": "Max vs submax eccentric bouts; leukocytes/cytokines to 4 d"
 },
 {
  "record_id": "FS-011189",
  "disposition": "ADVANCE",
  "primary_code": "",
  "secondary_codes": [],
  "study_type_hint": "acute_bout_CoreA",
  "note": "60-min moderate bout; lymphocyte/NK/phagocyte kinetics; open-window framing"
 },
 {
  "record_id": "FS-011196",
  "disposition": "ADVANCE",
  "primary_code": "",
  "secondary_codes": [],
  "study_type_hint": "acute_bout_CoreA",
  "note": "KSSD herb RCT; urinary Ig/beta2-microglobulin after maximal training"
 },
 {
  "record_id": "FS-011200",
  "disposition": "EXCLUDE_TA",
  "primary_code": "FT03",
  "secondary_codes": [],
  "study_type_hint": "chronic_training_only",
  "note": "Chronic heart failure patients; training vs rest crossover; clinical cohort"
 },
 {
  "record_id": "FS-011202",
  "disposition": "EXCLUDE_TA",
  "primary_code": "FT04",
  "secondary_codes": [],
  "study_type_hint": "chronic_training_only",
  "note": "18 cryotherapy procedures; WBC/IL-1beta at series baseline/end only"
 },
 {
  "record_id": "FS-011210",
  "disposition": "ADVANCE",
  "primary_code": "",
  "secondary_codes": [],
  "study_type_hint": "acute_bout_CoreA",
  "note": "Strenuous bout; IL-6/CRP pre, immediate, 2 h; cyclists"
 },
 {
  "record_id": "FS-011215",
  "disposition": "EXCLUDE_TA",
  "primary_code": "FT04",
  "secondary_codes": [],
  "study_type_hint": "chronic_training_only",
  "note": "5-y swimmer follow-up; sputum eosinophils/lymphocytes; no bout-tied sampling"
 },
 {
  "record_id": "FS-011224",
  "disposition": "AWAITING_CLASSIFICATION",
  "primary_code": "",
  "secondary_codes": [],
  "study_type_hint": "acute_bout_CoreA",
  "note": "Abstract missing; title indicates marathon neutrophil mobilisation study"
 },
 {
  "record_id": "FS-011242",
  "disposition": "ADVANCE",
  "primary_code": "",
  "secondary_codes": [],
  "study_type_hint": "acute_bout_CoreA",
  "note": "Max incremental test; TNF-alpha/sTNF-R1 pre and post"
 },
 {
  "record_id": "FS-011243",
  "disposition": "ADVANCE",
  "primary_code": "",
  "secondary_codes": [],
  "study_type_hint": "acute_bout_CoreA",
  "note": "Aerobic vs Wingate; Ig/complement, ACTH/cortisol; sedentary controls"
 },
 {
  "record_id": "FS-011249",
  "disposition": "ADVANCE",
  "primary_code": "",
  "secondary_codes": [],
  "study_type_hint": "acute_bout_CoreA",
  "note": "Marathon; neopterin/IgG/IgA/IgM with plasma-volume correction"
 },
 {
  "record_id": "FS-011252",
  "disposition": "ADVANCE",
  "primary_code": "",
  "secondary_codes": [],
  "study_type_hint": "acute_bout_CoreA",
  "note": "Max exercise and marathon; IL-12 p40/p70, Th1/Th2 cytokines"
 },
 {
  "record_id": "FS-011285",
  "disposition": "ADVANCE",
  "primary_code": "",
  "secondary_codes": [],
  "study_type_hint": "acute_bout_CoreA",
  "note": "ECC vs CON knee-extension bouts; IL-6/CK to 48 h; within-subject"
 },
 {
  "record_id": "FS-011303",
  "disposition": "EXCLUDE_TA",
  "primary_code": "FT04",
  "secondary_codes": [],
  "study_type_hint": "cross_sectional_resting",
  "note": "Training-status groups; resting T/NK/IL-12/IFN-gamma; no bout"
 },
 {
  "record_id": "FS-011313",
  "disposition": "ADVANCE",
  "primary_code": "",
  "secondary_codes": [],
  "study_type_hint": "acute_bout_CoreA",
  "note": "Judo session; neutrophil burst/phagocytosis/CD11b/CD16 before-after"
 },
 {
  "record_id": "FS-011326",
  "disposition": "EXCLUDE_TA",
  "primary_code": "FT07",
  "secondary_codes": [],
  "study_type_hint": "acute_bout_CoreA",
  "note": "Ibuprofen/acetaminophen RCT; protein synthesis/CK only, no immune measure"
 },
 {
  "record_id": "FS-011327",
  "disposition": "ADVANCE",
  "primary_code": "",
  "secondary_codes": [],
  "study_type_hint": "repeated_bouts_SupportB",
  "note": "6-wk overreaching; weekly cytokines/sIgA; bout-sampling tie unclear"
 },
 {
  "record_id": "FS-011349",
  "disposition": "EXCLUDE_TA",
  "primary_code": "FT03",
  "secondary_codes": [],
  "study_type_hint": "acute_bout_CoreA",
  "note": "Ischaemic heart disease patients; neutrophil apoptosis; clinical cohort"
 },
 {
  "record_id": "FS-011357",
  "disposition": "AWAITING_CLASSIFICATION",
  "primary_code": "",
  "secondary_codes": [],
  "study_type_hint": "acute_bout_CoreA",
  "note": "Abstract missing; title indicates acute exercise, lymphocyte receptor"
 },
 {
  "record_id": "FS-011363",
  "disposition": "ADVANCE",
  "primary_code": "",
  "secondary_codes": [],
  "study_type_hint": "acute_bout_CoreA",
  "note": "Blueberry/vitamin C/placebo crossover; heat run; cytokines 0-30 min"
 },
 {
  "record_id": "FS-011375",
  "disposition": "ADVANCE",
  "primary_code": "",
  "secondary_codes": [],
  "study_type_hint": "acute_bout_CoreA",
  "note": "Echinacea RCT; triathlon sprint; lymphocytes/sIL-2R/IL-6"
 },
 {
  "record_id": "FS-011378",
  "disposition": "ADVANCE",
  "primary_code": "",
  "secondary_codes": [],
  "study_type_hint": "acute_bout_CoreA",
  "note": "L. casei vs standard milk crossover; NK/cytokines around test"
 },
 {
  "record_id": "FS-011412",
  "disposition": "ADVANCE",
  "primary_code": "",
  "secondary_codes": [],
  "study_type_hint": "other",
  "note": "Massage after sport; immunological responses named; minimal abstract"
 },
 {
  "record_id": "FS-011416",
  "disposition": "ADVANCE",
  "primary_code": "",
  "secondary_codes": [],
  "study_type_hint": "acute_bout_CoreA",
  "note": "Wingate/treadmill tests; CD3/CD4/CD8/CD19/CD16; 'young athletes' age unstated"
 },
 {
  "record_id": "FS-011431",
  "disposition": "ADVANCE",
  "primary_code": "",
  "secondary_codes": [],
  "study_type_hint": "acute_bout_CoreA",
  "note": "Maximal bout; neutrophil ROS chemiluminescence to 2 h; skiers"
 },
 {
  "record_id": "FS-011432",
  "disposition": "ADVANCE",
  "primary_code": "",
  "secondary_codes": [],
  "study_type_hint": "repeated_bouts_SupportB",
  "note": "20-day ultra race; daily leukocytes/CRP/hormones time course"
 },
 {
  "record_id": "FS-011442",
  "disposition": "ADVANCE",
  "primary_code": "",
  "secondary_codes": [],
  "study_type_hint": "acute_bout_CoreA",
  "note": "Two cycle tests; salivary IgA 5/60 min; PE students"
 },
 {
  "record_id": "FS-011458",
  "disposition": "EXCLUDE_TA",
  "primary_code": "FT01",
  "secondary_codes": [],
  "study_type_hint": "acute_bout_CoreA",
  "note": "FASEB Journal meeting abstract; immunoglobulin response data"
 },
 {
  "record_id": "FS-011486",
  "disposition": "EXCLUDE_TA",
  "primary_code": "FT01",
  "secondary_codes": [],
  "study_type_hint": "acute_bout_CoreA",
  "note": "FASEB Journal meeting abstract; lymphocyte subsets/dexamethasone"
 },
 {
  "record_id": "FS-011491",
  "disposition": "EXCLUDE_TA",
  "primary_code": "FT01",
  "secondary_codes": [],
  "study_type_hint": "acute_bout_CoreA",
  "note": "FASEB Journal meeting abstract; salivary IgA after ergometer exercise"
 }
]