[
 {
  "record_id": "FS-002663",
  "disposition": "ADVANCE",
  "primary_code": "",
  "secondary_codes": [],
  "study_type_hint": "acute_bout_CoreA",
  "note": "off-road race, sTNFR1 serial sampling pre/post/1h/2h/24h"
 },
 {
  "record_id": "FS-002664",
  "disposition": "EXCLUDE_TA",
  "primary_code": "FT07",
  "secondary_codes": [],
  "study_type_hint": "acute_bout_CoreA",
  "note": "hyponatremia/electrolyte study, no immune measure"
 },
 {
  "record_id": "FS-002665",
  "disposition": "ADVANCE",
  "primary_code": "",
  "secondary_codes": [],
  "study_type_hint": "other",
  "note": "SPLUNC1 innate immune protein, allergic rhinitis vs healthy, exercise timing unclear"
 },
 {
  "record_id": "FS-002666",
  "disposition": "ADVANCE",
  "primary_code": "",
  "secondary_codes": [],
  "study_type_hint": "acute_bout_CoreA",
  "note": "half-marathon, LPS-stimulated whole blood innate immune gene expression"
 },
 {
  "record_id": "FS-002667",
  "disposition": "ADVANCE",
  "primary_code": "",
  "secondary_codes": [],
  "study_type_hint": "chronic_training_only",
  "note": "aged men, resveratrol/exercise, TNF-a mRNA and IkB protein in muscle"
 },
 {
  "record_id": "FS-002669",
  "disposition": "ADVANCE",
  "primary_code": "",
  "secondary_codes": [],
  "study_type_hint": "acute_bout_CoreA",
  "note": "acute one-legged exercise, CX3CL1/CCL2 chemokines identified as myokines"
 },
 {
  "record_id": "FS-002670",
  "disposition": "ADVANCE",
  "primary_code": "",
  "secondary_codes": [],
  "study_type_hint": "acute_bout_CoreA",
  "note": "HIIT session, IL-6/IL-8/IL-10/TNF-a/MCP-1 pre/post, 2-wk training moderator"
 },
 {
  "record_id": "FS-002671",
  "disposition": "ADVANCE",
  "primary_code": "",
  "secondary_codes": [],
  "study_type_hint": "acute_bout_CoreA",
  "note": "800 subjects, leukocyte/neutrophil/eosinophil counts pre/post exercise"
 },
 {
  "record_id": "FS-002672",
  "disposition": "ADVANCE",
  "primary_code": "",
  "secondary_codes": [],
  "study_type_hint": "cross_sectional_resting",
  "note": "marathon runners vs sedentary spouses, CRP among risk factors, no acute bout sampling"
 },
 {
  "record_id": "FS-002673",
  "disposition": "EXCLUDE_TA",
  "primary_code": "FT03",
  "secondary_codes": [
   "FT04"
  ],
  "study_type_hint": "other",
  "note": "pulmonary arterial hypertension patients, clinical cohort, no exercise bout"
 },
 {
  "record_id": "FS-002674",
  "disposition": "ADVANCE",
  "primary_code": "",
  "secondary_codes": [],
  "study_type_hint": "acute_bout_CoreA",
  "note": "JUICE vs control cyclists, IL-6/TNF-a/phagocytosis pre/post overreaching"
 },
 {
  "record_id": "FS-002675",
  "disposition": "ADVANCE",
  "primary_code": "",
  "secondary_codes": [],
  "study_type_hint": "chronic_training_only",
  "note": "sedentary men half-marathon training, CRP and inflammatory gene expression"
 },
 {
  "record_id": "FS-002677",
  "disposition": "EXCLUDE_TA",
  "primary_code": "FT03",
  "secondary_codes": [],
  "study_type_hint": "other",
  "note": "COPD patients, clinical cohort, obesity determinants of capacity"
 },
 {
  "record_id": "FS-002678",
  "disposition": "ADVANCE",
  "primary_code": "",
  "secondary_codes": [],
  "study_type_hint": "acute_bout_CoreA",
  "note": "tart cherry vs placebo, IL-6/TNF-a/hsCRP pre/post repeated cycling days"
 },
 {
  "record_id": "FS-002680",
  "disposition": "EXCLUDE_TA",
  "primary_code": "FT04",
  "secondary_codes": [
   "FT07"
  ],
  "study_type_hint": "other",
  "note": "diurnal hormone study, no exercise bout, no immune measure"
 },
 {
  "record_id": "FS-002683",
  "disposition": "ADVANCE",
  "primary_code": "",
  "secondary_codes": [],
  "study_type_hint": "acute_bout_CoreA",
  "note": "exercise-before-diving, neutrophil/platelet activation markers serial"
 },
 {
  "record_id": "FS-002684",
  "disposition": "ADVANCE",
  "primary_code": "",
  "secondary_codes": [],
  "study_type_hint": "acute_bout_CoreA",
  "note": "IL-6 assay methods study, rest/during/post exercise sampling"
 },
 {
  "record_id": "FS-002687",
  "disposition": "EXCLUDE_TA",
  "primary_code": "FT07",
  "secondary_codes": [],
  "study_type_hint": "other",
  "note": "germline cytokine-gene SNP genotype, not a post-exercise immune measure"
 },
 {
  "record_id": "FS-002688",
  "disposition": "ADVANCE",
  "primary_code": "",
  "secondary_codes": [],
  "study_type_hint": "acute_bout_CoreA",
  "note": "Ironman race, cytokines/CRP 24h pre and 20min post-race"
 },
 {
  "record_id": "FS-002689",
  "disposition": "EXCLUDE_TA",
  "primary_code": "FT03",
  "secondary_codes": [
   "FT04"
  ],
  "study_type_hint": "other",
  "note": "knee osteoarthritis patients, clinical cohort, no exercise bout"
 },
 {
  "record_id": "FS-002691",
  "disposition": "EXCLUDE_TA",
  "primary_code": "FT03",
  "secondary_codes": [
   "FT04"
  ],
  "study_type_hint": "other",
  "note": "advanced heart failure patients, clinical cohort, resting biomarker correlates"
 },
 {
  "record_id": "FS-002692",
  "disposition": "ADVANCE",
  "primary_code": "",
  "secondary_codes": [],
  "study_type_hint": "acute_bout_CoreA",
  "note": "NMES/CWI recovery, CRP/IL-10 pre/post resistance exercise"
 },
 {
  "record_id": "FS-002693",
  "disposition": "EXCLUDE_TA",
  "primary_code": "FT07",
  "secondary_codes": [],
  "study_type_hint": "acute_bout_CoreA",
  "note": "myostatin/FLRG only, not an immune measure"
 },
 {
  "record_id": "FS-002694",
  "disposition": "ADVANCE",
  "primary_code": "",
  "secondary_codes": [],
  "study_type_hint": "acute_bout_CoreA",
  "note": "CWI vs TNI triathletes, IL-10 after running intervals"
 },
 {
  "record_id": "FS-002695",
  "disposition": "ADVANCE",
  "primary_code": "",
  "secondary_codes": [],
  "study_type_hint": "acute_bout_CoreA",
  "note": "smokers vs non-smokers cycling bout, WBC measured pre/post"
 },
 {
  "record_id": "FS-002696",
  "disposition": "ADVANCE",
  "primary_code": "",
  "secondary_codes": [],
  "study_type_hint": "acute_bout_CoreA",
  "note": "lymphocyte/monocyte Hsp72 measured before/after heat exercise"
 },
 {
  "record_id": "FS-002697",
  "disposition": "ADVANCE",
  "primary_code": "",
  "secondary_codes": [],
  "study_type_hint": "acute_bout_CoreA",
  "note": "herbal supplement crossover, leukocyte counts after cycling bout"
 },
 {
  "record_id": "FS-002698",
  "disposition": "ADVANCE",
  "primary_code": "",
  "secondary_codes": [],
  "study_type_hint": "chronic_training_only",
  "note": "obese older adults, 12-wk training, hsCRP and fetuin-A pre/post"
 },
 {
  "record_id": "FS-002699",
  "disposition": "ADVANCE",
  "primary_code": "",
  "secondary_codes": [],
  "study_type_hint": "acute_bout_CoreA",
  "note": "HMB-FA/CWI, IL-6/IL-10/CRP after resistance exercise"
 },
 {
  "record_id": "FS-002700",
  "disposition": "EXCLUDE_TA",
  "primary_code": "FT03",
  "secondary_codes": [
   "FT04"
  ],
  "study_type_hint": "other",
  "note": "cardiac syndrome X/CAD patients, clinical cohort, resting NLR/hsCRP"
 },
 {
  "record_id": "FS-002701",
  "disposition": "ADVANCE",
  "primary_code": "",
  "secondary_codes": [],
  "study_type_hint": "acute_bout_CoreA",
  "note": "trained vs sedentary men, TNF-a/IL-6/IL-8 pre/post treadmill run"
 },
 {
  "record_id": "FS-002702",
  "disposition": "ADVANCE",
  "primary_code": "",
  "secondary_codes": [],
  "study_type_hint": "acute_bout_CoreA",
  "note": "DHA vs placebo footballers, PBMC ROS after immune stimulation"
 },
 {
  "record_id": "FS-002703",
  "disposition": "ADVANCE",
  "primary_code": "",
  "secondary_codes": [],
  "study_type_hint": "acute_bout_CoreA",
  "note": "avenanthramide vs control, neutrophil burst/CRP/IL-1b after downhill walking"
 },
 {
  "record_id": "FS-002705",
  "disposition": "EXCLUDE_TA",
  "primary_code": "FT03",
  "secondary_codes": [
   "FT04"
  ],
  "study_type_hint": "other",
  "note": "idiopathic anaphylaxis patients, allergen IgE testing, no exercise"
 },
 {
  "record_id": "FS-002706",
  "disposition": "ADVANCE",
  "primary_code": "",
  "secondary_codes": [],
  "study_type_hint": "chronic_training_only",
  "note": "obese postmenopausal women, 6-mo training, TNF-a/IL-6 pre/post"
 },
 {
  "record_id": "FS-002707",
  "disposition": "ADVANCE",
  "primary_code": "",
  "secondary_codes": [],
  "study_type_hint": "acute_bout_CoreA",
  "note": "periodic acceleration recovery, IL-6/TNF-a/IL-10 after eccentric exercise"
 },
 {
  "record_id": "FS-002708",
  "disposition": "ADVANCE",
  "primary_code": "",
  "secondary_codes": [],
  "study_type_hint": "acute_bout_CoreA",
  "note": "HI/SR resistance protocol, IL-6 serial sampling men and women"
 },
 {
  "record_id": "FS-002709",
  "disposition": "ADVANCE",
  "primary_code": "",
  "secondary_codes": [],
  "study_type_hint": "acute_bout_CoreA",
  "note": "athletes grouped by ferritin, IL-6/hepcidin pre/post/3h running"
 },
 {
  "record_id": "FS-002710",
  "disposition": "ADVANCE",
  "primary_code": "",
  "secondary_codes": [],
  "study_type_hint": "chronic_training_only",
  "note": "soccer players seasonal timepoints, CRP among biochemical markers"
 },
 {
  "record_id": "FS-002711",
  "disposition": "ADVANCE",
  "primary_code": "",
  "secondary_codes": [],
  "study_type_hint": "acute_bout_CoreA",
  "note": "DHA footballers, neutrophil RONS after immune stimulation post-exercise"
 }
]